{
  "plugin_manifest_schema_version": "plugin-manifest.schema.v1",
  "id": "uml-xmi",
  "version": "2026.07.4",
  "executable": "dediren-plugin-uml-xmi-export",
  "capabilities": ["export"],
  "allowed_env": [
    "DEDIREN_XMI_SCHEMA_PATH",
    "DEDIREN_SCHEMA_CACHE_DIR",
    "HTTP_PROXY",
    "HTTPS_PROXY",
    "NO_PROXY",
    "http_proxy",
    "https_proxy",
    "no_proxy",
    "JAVA_HOME",
    "PATH"
  ]
}
